,city,company,country,date,expired,formattedLocation,formattedLocationFull,formattedRelativeTime,indeedApply,jobkey,jobtitle,onmousedown,snippet,source,sponsored,state,stations,url
133,San Francisco,Salesforce,US,"Tue, 28 Feb 2017 21:15:22 GMT",False,"San Francisco, CA","San Francisco, CA",11 days ago,False,7858598c57c799ed,Software Engineer,"indeed_clk(this,'1216');","Knowledge of <b>Python</b>, Objective-C, Javascript, SQL, C++, <b>Java</b>, or the ability to learn them quickly. We pride ourselves on writing high-quality code and...",Salesforce,False,CA,,http://www.indeed.com/viewjob?jk=7858598c57c799ed&qd=kzI5tJZPkWJqoVrEwKNhYk2EwljmS6RpeWCeAeJNcjUsMOgh67uUC7WoMUm7Ml1dnuwGf1zpMw3Ed9ueZsPOdWf-XHgHOKyIJO9AK_lLAVuOBZn11Ijk5RZwiwLGfEAN&indpubnum=8836246992678581&atk=1bb1vrftj1a4v4vg
134,San Francisco,MuleSoft,US,"Tue, 28 Feb 2017 01:50:52 GMT",False,"San Francisco, CA","San Francisco, CA 94108",12 days ago,True,a7d73be9be069cca,Software Engineer,"indeed_clk(this,'1216');","Expert in at least one language and excited to learn others—our engineers have all kinds of backgrounds, including <b>Java</b>, C++, <b>Python</b> and JavaScript....",Mulesoft,False,CA,,http://www.indeed.com/viewjob?jk=a7d73be9be069cca&qd=kzI5tJZPkWJqoVrEwKNhYk2EwljmS6RpeWCeAeJNcjUsMOgh67uUC7WoMUm7Ml1dnuwGf1zpMw3Ed9ueZsPOdWf-XHgHOKyIJO9AK_lLAVuOBZn11Ijk5RZwiwLGfEAN&indpubnum=8836246992678581&atk=1bb1vrftj1a4v4vg
135,San Francisco,Indeed,US,"Sat, 25 Feb 2017 00:29:38 GMT",False,"San Francisco, CA","San Francisco, CA 94102",15 days ago,True,41d21cea1c35316d,Senior Software Engineer,"indeed_clk(this,'1216');","<b>Java</b>, Javascript, <b>Python</b>, Lucene, MySQL, MongoDB and many more. 5 or more years experience in software development with at least 3 years in <b>Java</b> programming....",Indeed,False,CA,,http://www.indeed.com/viewjob?jk=41d21cea1c35316d&qd=kzI5tJZPkWJqoVrEwKNhYk2EwljmS6RpeWCeAeJNcjUsMOgh67uUC7WoMUm7Ml1dnuwGf1zpMw3Ed9ueZsPOdWf-XHgHOKyIJO9AK_lLAVuOBZn11Ijk5RZwiwLGfEAN&indpubnum=8836246992678581&atk=1bb1vrftj1a4v4vg
136,San Francisco,Radius,US,"Fri, 03 Mar 2017 00:35:45 GMT",False,"San Francisco, CA","San Francisco, CA",9 days ago,False,ec7d9dc9d9e57895,Senior Software Engineer,"indeed_clk(this,'1216');","Advanced experience with <b>Java</b> and <b>Python</b> (additional languages preferred). Radius is a fast-growing, venture-backed startup in the heart of San Francisco....",Radius,False,CA,,http://www.indeed.com/viewjob?jk=ec7d9dc9d9e57895&qd=kzI5tJZPkWJqoVrEwKNhYk2EwljmS6RpeWCeAeJNcjUsMOgh67uUC7WoMUm7Ml1dnuwGf1zpMw3Ed9ueZsPOdWf-XHgHOKyIJO9AK_lLAVuOBZn11Ijk5RZwiwLGfEAN&indpubnum=8836246992678581&atk=1bb1vrftj1a4v4vg
137,Sausalito,BSSP,US,"Fri, 03 Mar 2017 06:59:45 GMT",False,"Sausalito, CA","Sausalito, CA",9 days ago,False,10784da6be57fd45,Data Engineer,"indeed_clk(this,'1216');",Advanced degree in statistics / advanced math / econometrics preferred Experience manipulating messy data and merging multip le and large complicated data sets...,BSSP,False,CA,,http://www.indeed.com/viewjob?jk=10784da6be57fd45&qd=kzI5tJZPkWJqoVrEwKNhYk2EwljmS6RpeWCeAeJNcjUsMOgh67uUC7WoMUm7Ml1dnuwGf1zpMw3Ed9ueZsPOdWf-XHgHOKyIJO9AK_lLAVuOBZn11Ijk5RZwiwLGfEAN&indpubnum=8836246992678581&atk=1bb1vrftj1a4v4vg
138,Redwood City,Proteus Digital Health,US,"Fri, 10 Mar 2017 04:09:35 GMT",False,"Redwood City, CA","Redwood City, CA 94065",2 days ago,False,541607fa3f0585ec,Data Engineer,"indeed_clk(this,'1216');","(<b>Python</b>, Scala, <b>Java</b> or other Object Oriented Programming languages). Build and maintain data pipelines to support analytics (requirements gathering, data...",Proteus Digital Health,False,CA,,http://www.indeed.com/viewjob?jk=541607fa3f0585ec&qd=kzI5tJZPkWJqoVrEwKNhYk2EwljmS6RpeWCeAeJNcjUsMOgh67uUC7WoMUm7Ml1dnuwGf1zpMw3Ed9ueZsPOdWf-XHgHOKyIJO9AK_lLAVuOBZn11Ijk5RZwiwLGfEAN&indpubnum=8836246992678581&atk=1bb1vrftj1a4v4vg
139,San Francisco,Prism Inc.,US,"Thu, 23 Feb 2017 15:50:22 GMT",False,"San Francisco, CA","San Francisco, CA",17 days ago,True,e4643492b1388d56,"Java Developer (Oakland, CA)","indeed_clk(this,'1216');","<b>Java</b>, <b>Python</b>, Scala and other equivalent languages:. Experience in <b>Java</b>, <b>Python</b>, Scala and other equivalent languages....",Indeed,False,CA,,http://www.indeed.com/viewjob?jk=e4643492b1388d56&qd=kzI5tJZPkWJqoVrEwKNhYk2EwljmS6RpeWCeAeJNcjUsMOgh67uUC7WoMUm7Ml1dnuwGf1zpMw3Ed9ueZsPOdWf-XHgHOKyIJO9AK_lLAVuOBZn11Ijk5RZwiwLGfEAN&indpubnum=8836246992678581&atk=1bb1vrftj1a4v4vg
140,San Francisco,General Motors,US,"Fri, 20 Jan 2017 11:32:18 GMT",False,"San Francisco, CA","San Francisco, CA",30+ days ago,False,d348b06f68e7a97a,Senior Software Engineer - GCC0001220,"indeed_clk(this,'1216');","Current experience with Golang, Polymer, JavaScript, HTML5, CSS, <b>Python</b>, <b>Java</b>, Microservices. Infotainment, telematics and &quot;connected customers&quot; are critical...",General Motors,False,CA,,http://www.indeed.com/viewjob?jk=d348b06f68e7a97a&qd=kzI5tJZPkWJqoVrEwKNhYk2EwljmS6RpeWCeAeJNcjUsMOgh67uUC7WoMUm7Ml1dnuwGf1zpMw3Ed9ueZsPOdWf-XHgHOKyIJO9AK_lLAVuOBZn11Ijk5RZwiwLGfEAN&indpubnum=8836246992678581&atk=1bb1vrftj1a4v4vg
141,San Francisco,ITL USA,US,"Wed, 15 Feb 2017 23:54:15 GMT",False,"San Francisco, CA","San Francisco, CA",24 days ago,False,183e76c75f2295e1,Associate Data Scientist,"indeed_clk(this,'1216');","Experience in general programming language such as Ruby, <b>Python</b>, Perl, <b>Java</b>, or C. Infosys – Analytics – US - Senior Associate - Data Scientist....",Infosys,False,CA,,http://www.indeed.com/viewjob?jk=183e76c75f2295e1&qd=kzI5tJZPkWJqoVrEwKNhYk2EwljmS6RpeWCeAeJNcjUsMOgh67uUC7WoMUm7Ml1dnuwGf1zpMw3Ed9ueZsPOdWf-XHgHOKyIJO9AK_lLAVuOBZn11Ijk5RZwiwLGfEAN&indpubnum=8836246992678581&atk=1bb1vrftj1a4v4vg
142,San Francisco,Blue Shield of California,US,"Fri, 24 Feb 2017 19:18:28 GMT",False,"San Francisco, CA","San Francisco, CA 94105",16 days ago,False,94bec9d0c527c47b,Applications Developer 6,"indeed_clk(this,'1216');","Experience in programming languages like <b>Java</b>, <b>Python</b> is preferred. Includes of SQL, shell scripting, and <b>Python</b> programming....",Blue Shield of California,False,CA,,http://www.indeed.com/viewjob?jk=94bec9d0c527c47b&qd=kzI5tJZPkWJqoVrEwKNhYk2EwljmS6RpeWCeAeJNcjUsMOgh67uUC7WoMUm7Ml1dnuwGf1zpMw3Ed9ueZsPOdWf-XHgHOKyIJO9AK_lLAVuOBZn11Ijk5RZwiwLGfEAN&indpubnum=8836246992678581&atk=1bb1vrftj1a4v4vg
143,San Francisco,Quid,US,"Sun, 25 Dec 2016 06:50:36 GMT",False,"San Francisco, CA","San Francisco, CA",30+ days ago,True,29864a60e819dc32,"Senior Software Engineer, Data Acquisition","indeed_clk(this,'1216');","Expert level knowledge in <b>Python</b>, we also use <b>Java</b>, Scala, C++ as needed (any combination of the above is ok)....",Quid,False,CA,,http://www.indeed.com/viewjob?jk=29864a60e819dc32&qd=kzI5tJZPkWJqoVrEwKNhYk2EwljmS6RpeWCeAeJNcjUsMOgh67uUC7WoMUm7Ml1dnuwGf1zpMw3Ed9ueZsPOdWf-XHgHOKyIJO9AK_lLAVuOBZn11Ijk5RZwiwLGfEAN&indpubnum=8836246992678581&atk=1bb1vrftj1a4v4vg
144,Oakland,EBMUD,US,"Wed, 01 Mar 2017 07:31:36 GMT",False,"Oakland, CA","Oakland, CA",11 days ago,False,228a67d9399e3384,Senior Programmer Analyst (GIS Architecture),"indeed_clk(this,'1216');","Programming using multiple environments, including Ruby on Rails, .Net, <b>Python</b>, <b>Java</b>, JavaScript, and SQL. Experience building ESRI geoprocessing tools using...",EBMUD,False,CA,,http://www.indeed.com/viewjob?jk=228a67d9399e3384&qd=kzI5tJZPkWJqoVrEwKNhYk2EwljmS6RpeWCeAeJNcjUsMOgh67uUC7WoMUm7Ml1dnuwGf1zpMw3Ed9ueZsPOdWf-XHgHOKyIJO9AK_lLAVuOBZn11Ijk5RZwiwLGfEAN&indpubnum=8836246992678581&atk=1bb1vrftj1a4v4vg
145,San Francisco Bay Area,Vapor IO,US,"Fri, 24 Feb 2017 08:16:53 GMT",False,"San Francisco Bay Area, CA","San Francisco Bay Area, CA",16 days ago,False,514acdda6a64b61e,Principal Architect,"indeed_clk(this,'1216');","Strong working knowledge of modern software development languages including <b>Java</b>, Scala, <b>Python</b>, Bash, Go, and C++....",Vapor IO,False,CA,,http://www.indeed.com/viewjob?jk=514acdda6a64b61e&qd=kzI5tJZPkWJqoVrEwKNhYk2EwljmS6RpeWCeAeJNcjUsMOgh67uUC7WoMUm7Ml1dnuwGf1zpMw3Ed9ueZsPOdWf-XHgHOKyIJO9AK_lLAVuOBZn11Ijk5RZwiwLGfEAN&indpubnum=8836246992678581&atk=1bb1vrftj1a4v4vg
146,San Francisco,Dispatchr,US,"Sun, 19 Feb 2017 11:53:35 GMT",False,"San Francisco, CA","San Francisco, CA",21 days ago,True,a8cb73a1266d9049,Full Stack Engineer,"indeed_clk(this,'1216');","Backend experience with one of Javascript, <b>Python</b>, <b>Java</b>, Ruby, Perl, ... Through our growing ecosystem of products and services, we're building a different kind...",Dispatchr,False,CA,,http://www.indeed.com/viewjob?jk=a8cb73a1266d9049&qd=kzI5tJZPkWJqoVrEwKNhYk2EwljmS6RpeWCeAeJNcjUsMOgh67uUC7WoMUm7Ml1dnuwGf1zpMw3Ed9ueZsPOdWf-XHgHOKyIJO9AK_lLAVuOBZn11Ijk5RZwiwLGfEAN&indpubnum=8836246992678581&atk=1bb1vrftj1a4v4vg
147,San Francisco,Indeed,US,"Tue, 07 Feb 2017 23:57:26 GMT",False,"San Francisco, CA","San Francisco, CA 94102",30+ days ago,True,64a0605daeea0d0c,Software Engineer Mobile Applications,"indeed_clk(this,'1216');","<b>Java</b>, Javascript, <b>Python</b>, React and React Native, Objective C and Swift, MySQL, MongoDB and many more. As the world’s number 1 job site, our mission is to help...",Indeed,False,CA,,http://www.indeed.com/viewjob?jk=64a0605daeea0d0c&qd=kzI5tJZPkWJqoVrEwKNhYk2EwljmS6RpeWCeAeJNcjUsMOgh67uUC7WoMUm7Ml1dnuwGf1zpMw3Ed9ueZsPOdWf-XHgHOKyIJO9AK_lLAVuOBZn11Ijk5RZwiwLGfEAN&indpubnum=8836246992678581&atk=1bb1vrftj1a4v4vg
148,San Francisco,zeroseven.io,US,"Thu, 19 Jan 2017 00:50:15 GMT",False,"San Francisco, CA","San Francisco, CA",30+ days ago,True,718df4b6d291416f,Front End Developer - javascript (ES6 and d3.js),"indeed_clk(this,'1216');","2+ years experience with JavaScript, or other general purpose programming languages like C/C++, <b>Java</b>, <b>Python</b>, or Ruby and a willingness and interest in...",zeroseven.io,False,CA,,http://www.indeed.com/viewjob?jk=718df4b6d291416f&qd=kzI5tJZPkWJqoVrEwKNhYk2EwljmS6RpeWCeAeJNcjUsMOgh67uUC7WoMUm7Ml1dnuwGf1zpMw3Ed9ueZsPOdWf-XHgHOKyIJO9AK_lLAVuOBZn11Ijk5RZwiwLGfEAN&indpubnum=8836246992678581&atk=1bb1vrftj1a4v4vg
149,San Francisco,Early Warning Services,US,"Wed, 08 Mar 2017 06:39:39 GMT",False,"San Francisco, CA","San Francisco, CA",4 days ago,False,31659e0a3fabdaa7,Sr. Software Engineer,"indeed_clk(this,'1216');","5+ years of experience in projects using <b>Java</b>, C++, Objective-C, or Swift. Experience with other computer languages like C#, Ruby, <b>Python</b>, and PHP is a plus....",Early Warning Services,False,CA,,http://www.indeed.com/viewjob?jk=31659e0a3fabdaa7&qd=kzI5tJZPkWJqoVrEwKNhYk2EwljmS6RpeWCeAeJNcjUsMOgh67uUC7WoMUm7Ml1dnuwGf1zpMw3Ed9ueZsPOdWf-XHgHOKyIJO9AK_lLAVuOBZn11Ijk5RZwiwLGfEAN&indpubnum=8836246992678581&atk=1bb1vrftj1a4v4vg
