,city,company,country,date,expired,formattedLocation,formattedLocationFull,formattedRelativeTime,indeedApply,jobkey,jobtitle,onmousedown,snippet,source,sponsored,state,stations,url
0,San Francisco,Lending Club,US,"Wed, 08 Mar 2017 23:16:07 GMT",False,"San Francisco, CA","San Francisco, CA 94105",3 days ago,False,296ed889e68805b0,"Sr Java Developer, Personal Loans","indeed_clk(this,'630');","Web-based software experience, <b>Java</b> background or similar (C#/.Net, Ruby, <b>Python</b>). <b>Java</b> Developer – Personal Loans, you will work on the platform that is...",Lending Club,False,CA,,http://www.indeed.com/viewjob?jk=296ed889e68805b0&qd=kzI5tJZPkWJqoVrEwKNhYk2EwljmS6RpeWCeAeJNcjUsMOgh67uUC7WoMUm7Ml1dnuwGf1zpMw3Ed9ueZsPOdWf-XHgHOKyIJO9AK_lLAVu-RVsLkIJ5cbpEhwcYwJqO&indpubnum=8836246992678581&atk=1bb1vrfb8a38jd1s
1,San Francisco,Lending Club,US,"Wed, 08 Mar 2017 23:15:52 GMT",False,"San Francisco, CA","San Francisco, CA 94105",3 days ago,False,1ee70e0f68bbf488,Sr Java Developer - Business Loans,"indeed_clk(this,'630');","<b>Java</b> and Web services. UNIX/Linux experience, and scripting skills (shell, Perl, <b>Python</b>, etc.). <b>Java</b> Developer – Business Loans, you will work on the platform...",Lending Club,False,CA,,http://www.indeed.com/viewjob?jk=1ee70e0f68bbf488&qd=kzI5tJZPkWJqoVrEwKNhYk2EwljmS6RpeWCeAeJNcjUsMOgh67uUC7WoMUm7Ml1dnuwGf1zpMw3Ed9ueZsPOdWf-XHgHOKyIJO9AK_lLAVu-RVsLkIJ5cbpEhwcYwJqO&indpubnum=8836246992678581&atk=1bb1vrfb8a38jd1s
2,San Francisco,Lending Club,US,"Tue, 07 Mar 2017 07:09:58 GMT",False,"San Francisco, CA","San Francisco, CA 94105",5 days ago,False,01063a0cd323de07,Sr. Java Developer,"indeed_clk(this,'630');","<b>Java</b> and Web services. UNIX/Linux experience, and scripting skills (shell, Perl, <b>Python</b>, etc.). <b>Java</b> Developer, you’ll work on the platform that is transforming...",Lending Club,False,CA,,http://www.indeed.com/viewjob?jk=01063a0cd323de07&qd=kzI5tJZPkWJqoVrEwKNhYk2EwljmS6RpeWCeAeJNcjUsMOgh67uUC7WoMUm7Ml1dnuwGf1zpMw3Ed9ueZsPOdWf-XHgHOKyIJO9AK_lLAVu-RVsLkIJ5cbpEhwcYwJqO&indpubnum=8836246992678581&atk=1bb1vrfb8a38jd1s
3,San Francisco,Infield Digital,US,"Fri, 10 Mar 2017 19:18:02 GMT",False,"San Francisco, CA","San Francisco, CA",2 days ago,True,1864688b51694153,Magento PHP Developer (San Francisco),"indeed_clk(this,'630');","Familiarity with other languages (<b>Java</b>, Ruby, <b>Python</b>, Objective-C, etc.). We are Infield Digital, a boutique web development agency focused on eCommerce,...",Infield Digital,False,CA,,http://www.indeed.com/viewjob?jk=1864688b51694153&qd=kzI5tJZPkWJqoVrEwKNhYk2EwljmS6RpeWCeAeJNcjUsMOgh67uUC7WoMUm7Ml1dnuwGf1zpMw3Ed9ueZsPOdWf-XHgHOKyIJO9AK_lLAVu-RVsLkIJ5cbpEhwcYwJqO&indpubnum=8836246992678581&atk=1bb1vrfb8a38jd1s
4,Oakland,Solar Mosaic,US,"Sun, 12 Mar 2017 06:51:21 GMT",False,"Oakland, CA","Oakland, CA",12 hours ago,True,1df2d78a0f09f218,Sr. Software Developer in Test,"indeed_clk(this,'630');","Proficiency with <b>Java</b> and a scripting language (e.g. Ruby, <b>Python</b>), and ability to write automated test code and tools....",Solar Mosaic,False,CA,,http://www.indeed.com/viewjob?jk=1df2d78a0f09f218&qd=kzI5tJZPkWJqoVrEwKNhYk2EwljmS6RpeWCeAeJNcjUsMOgh67uUC7WoMUm7Ml1dnuwGf1zpMw3Ed9ueZsPOdWf-XHgHOKyIJO9AK_lLAVu-RVsLkIJ5cbpEhwcYwJqO&indpubnum=8836246992678581&atk=1bb1vrfb8a38jd1s
5,San Francisco,Affirm,US,"Tue, 07 Feb 2017 07:37:18 GMT",False,"San Francisco, CA","San Francisco, CA 94126",30+ days ago,False,d1b4ee2f7cf30d74,Software Engineer - 2017 University Grad,"indeed_clk(this,'630');","<b>Python</b>, C/C++, <b>Java</b>, Javascript. Experience with <b>Python</b>, C/C++ or <b>Java</b>. As a recent university grad, you’ll contribute meaningfully to our top-notch engineering...",Affirm,False,CA,,http://www.indeed.com/viewjob?jk=d1b4ee2f7cf30d74&qd=kzI5tJZPkWJqoVrEwKNhYk2EwljmS6RpeWCeAeJNcjUsMOgh67uUC7WoMUm7Ml1dnuwGf1zpMw3Ed9ueZsPOdWf-XHgHOKyIJO9AK_lLAVu-RVsLkIJ5cbpEhwcYwJqO&indpubnum=8836246992678581&atk=1bb1vrfb8a38jd1s
6,San Francisco Bay Area,Wittaff,US,"Tue, 07 Mar 2017 01:22:29 GMT",False,"San Francisco Bay Area, CA","San Francisco Bay Area, CA",5 days ago,True,69ced1464e1cba98,Hadoop Developer,"indeed_clk(this,'630');",*5-10 years <b>Java</b> development experience*. • Fluency in <b>Java</b> MapReduce and Spark*. Hadoop Software Developer*....,Indeed,False,CA,,http://www.indeed.com/viewjob?jk=69ced1464e1cba98&qd=kzI5tJZPkWJqoVrEwKNhYk2EwljmS6RpeWCeAeJNcjUsMOgh67uUC7WoMUm7Ml1dnuwGf1zpMw3Ed9ueZsPOdWf-XHgHOKyIJO9AK_lLAVu-RVsLkIJ5cbpEhwcYwJqO&indpubnum=8836246992678581&atk=1bb1vrfb8a38jd1s
7,San Francisco Bay Area,"AgileSDE, LLC",US,"Tue, 14 Feb 2017 16:02:23 GMT",False,"San Francisco Bay Area, CA","San Francisco Bay Area, CA",26 days ago,True,da7cd6a8415d7ff5,Senior Software Engineer/ Java Developer,"indeed_clk(this,'630');","Strong experience with multiple languages - <b>Java</b>, <b>Python</b>, Scala, etc. Experience working in higher-level programming languages e.g. <b>Java</b>, Scala, <b>Python</b>....",Indeed,False,CA,,http://www.indeed.com/viewjob?jk=da7cd6a8415d7ff5&qd=kzI5tJZPkWJqoVrEwKNhYk2EwljmS6RpeWCeAeJNcjUsMOgh67uUC7WoMUm7Ml1dnuwGf1zpMw3Ed9ueZsPOdWf-XHgHOKyIJO9AK_lLAVu-RVsLkIJ5cbpEhwcYwJqO&indpubnum=8836246992678581&atk=1bb1vrfb8a38jd1s
8,San Francisco,AdRoll,US,"Thu, 23 Feb 2017 18:17:10 GMT",False,"San Francisco, CA","San Francisco, CA 94103",17 days ago,True,20f69995ce9d599f,Senior SFDC Developer,"indeed_clk(this,'630');","About the Role: AdRoll is committed to building an innovative, cutting edge and effective stack of tools to support Sales, Account Management, Finance, BI",Adroll,False,CA,,http://www.indeed.com/viewjob?jk=20f69995ce9d599f&qd=kzI5tJZPkWJqoVrEwKNhYk2EwljmS6RpeWCeAeJNcjUsMOgh67uUC7WoMUm7Ml1dnuwGf1zpMw3Ed9ueZsPOdWf-XHgHOKyIJO9AK_lLAVu-RVsLkIJ5cbpEhwcYwJqO&indpubnum=8836246992678581&atk=1bb1vrfb8a38jd1s
9,San Francisco,RichRelevance,US,"Wed, 08 Mar 2017 05:28:10 GMT",False,"San Francisco, CA","San Francisco, CA 94111",4 days ago,False,8b352ab0a0c374d7,Junior Software Engineer (Agile/Development),"indeed_clk(this,'630');",Jr. Software Engineer (Agile/Development) Primary responsibilities: Work on software development focused on large-scale distributed systems and with Hadoop...,RichRelevance,False,CA,,http://www.indeed.com/viewjob?jk=8b352ab0a0c374d7&qd=kzI5tJZPkWJqoVrEwKNhYk2EwljmS6RpeWCeAeJNcjUsMOgh67uUC7WoMUm7Ml1dnuwGf1zpMw3Ed9ueZsPOdWf-XHgHOKyIJO9AK_lLAVu-RVsLkIJ5cbpEhwcYwJqO&indpubnum=8836246992678581&atk=1bb1vrfb8a38jd1s
10,Redwood City,Electronic Arts,US,"Sun, 26 Feb 2017 06:38:09 GMT",False,"Redwood City, CA","Redwood City, CA 94065",14 days ago,False,9708edc33b4a2042,Software Engineer (University Grad),"indeed_clk(this,'630');","Fast prototyping skills, familiarity with scripting languages such as bash, SQL, perl, awk, <b>python</b>, demonstrated by advanced graduate level university course...",Electronic Arts,False,CA,,http://www.indeed.com/viewjob?jk=9708edc33b4a2042&qd=kzI5tJZPkWJqoVrEwKNhYk2EwljmS6RpeWCeAeJNcjUsMOgh67uUC7WoMUm7Ml1dnuwGf1zpMw3Ed9ueZsPOdWf-XHgHOKyIJO9AK_lLAVu-RVsLkIJ5cbpEhwcYwJqO&indpubnum=8836246992678581&atk=1bb1vrfb8a38jd1s
11,Emeryville,Realogy Corporate,US,"Sat, 11 Mar 2017 12:40:52 GMT",False,"Emeryville, CA","Emeryville, CA",1 day ago,False,d8c8316c057b28e9,Junior Data Engineer,"indeed_clk(this,'630');","Ability to write high-quality code in Scala, <b>Python</b>, or <b>Java</b>. Comfortable developing in <b>Python</b>, Clojure, or similar language. About ZapLabs LLC....",Realogy,False,CA,,http://www.indeed.com/viewjob?jk=d8c8316c057b28e9&qd=kzI5tJZPkWJqoVrEwKNhYk2EwljmS6RpeWCeAeJNcjUsMOgh67uUC7WoMUm7Ml1dnuwGf1zpMw3Ed9ueZsPOdWf-XHgHOKyIJO9AK_lLAVu-RVsLkIJ5cbpEhwcYwJqO&indpubnum=8836246992678581&atk=1bb1vrfb8a38jd1s
12,San Francisco,Verizon,US,"Sat, 25 Feb 2017 02:31:12 GMT",False,"San Francisco, CA","San Francisco, CA 94103",15 days ago,False,0528dfaa3370c021,Full Stack Software Developer,"indeed_clk(this,'630');","CoffeeScript, ES6, <b>Python</b>, Objective-C, Swift, <b>Java</b>. We're a small, unique team that has strong experience building and innovating in video at places like Hulu,...",Verizon,False,CA,,http://www.indeed.com/viewjob?jk=0528dfaa3370c021&qd=kzI5tJZPkWJqoVrEwKNhYk2EwljmS6RpeWCeAeJNcjUsMOgh67uUC7WoMUm7Ml1dnuwGf1zpMw3Ed9ueZsPOdWf-XHgHOKyIJO9AK_lLAVu-RVsLkIJ5cbpEhwcYwJqO&indpubnum=8836246992678581&atk=1bb1vrfb8a38jd1s
13,Richmond,Axiom Exergy,US,"Wed, 22 Feb 2017 00:23:15 GMT",False,"Richmond, CA","Richmond, CA 94804",18 days ago,True,dc35ff6c5a545a48,Software Engineering Intern,"indeed_clk(this,'630');","<b>Python</b>, Node.JS, HTML5 / CSS3, JQuery preferred. Consider a Linux machine running multiple <b>Java</b> services. What would be a good way to synchronize a <b>Java</b> object...",Axiom Exergy,False,CA,,http://www.indeed.com/viewjob?jk=dc35ff6c5a545a48&qd=kzI5tJZPkWJqoVrEwKNhYk2EwljmS6RpeWCeAeJNcjUsMOgh67uUC7WoMUm7Ml1dnuwGf1zpMw3Ed9ueZsPOdWf-XHgHOKyIJO9AK_lLAVu-RVsLkIJ5cbpEhwcYwJqO&indpubnum=8836246992678581&atk=1bb1vrfb8a38jd1s
14,San Francisco,iRhythm,US,"Wed, 08 Mar 2017 21:37:13 GMT",False,"San Francisco, CA","San Francisco, CA",3 days ago,True,cfbe986f096e033b,Lead SQA Automation Engineer,"indeed_clk(this,'630');","<b>Java</b>, <b>Python</b>, Perl, Ruby, C/C++, and/or .NET/C#. IRhythm is a San Francisco-based digital healthcare company, redefining the way cardiac arrhythmias are...",iRhythm,False,CA,,http://www.indeed.com/viewjob?jk=cfbe986f096e033b&qd=kzI5tJZPkWJqoVrEwKNhYk2EwljmS6RpeWCeAeJNcjUsMOgh67uUC7WoMUm7Ml1dnuwGf1zpMw3Ed9ueZsPOdWf-XHgHOKyIJO9AK_lLAVu-RVsLkIJ5cbpEhwcYwJqO&indpubnum=8836246992678581&atk=1bb1vrfb8a38jd1s
15,San Francisco,Rocket Lawyer,US,"Fri, 17 Feb 2017 22:22:23 GMT",False,"San Francisco, CA","San Francisco, CA",22 days ago,False,30ac5c107667a433,Data Analyst,"indeed_clk(this,'630');","<b>Python</b>, <b>Java</b>, etc.). At Rocket Lawyer, we want to change things by making legal services affordable, simple and available to more people than ever before....",Rocket Lawyer,False,CA,,http://www.indeed.com/viewjob?jk=30ac5c107667a433&qd=kzI5tJZPkWJqoVrEwKNhYk2EwljmS6RpeWCeAeJNcjUsMOgh67uUC7WoMUm7Ml1dnuwGf1zpMw3Ed9ueZsPOdWf-XHgHOKyIJO9AK_lLAVu-RVsLkIJ5cbpEhwcYwJqO&indpubnum=8836246992678581&atk=1bb1vrfb8a38jd1s
16,San Francisco,Koding,US,"Tue, 07 Mar 2017 07:22:50 GMT",False,"San Francisco, CA","San Francisco, CA",5 days ago,False,a92cd6ce33424eaf,Backend Engineer,"indeed_clk(this,'630');","You will be up and running in minutes on your own cloud-based Linux boxes where you can learn programming languages like Ruby, Go, <b>Java</b>, NodeJS, PHP, C, C++,...",Koding,False,CA,,http://www.indeed.com/viewjob?jk=a92cd6ce33424eaf&qd=kzI5tJZPkWJqoVrEwKNhYk2EwljmS6RpeWCeAeJNcjUsMOgh67uUC7WoMUm7Ml1dnuwGf1zpMw3Ed9ueZsPOdWf-XHgHOKyIJO9AK_lLAVu-RVsLkIJ5cbpEhwcYwJqO&indpubnum=8836246992678581&atk=1bb1vrfb8a38jd1s
17,San Francisco,Upsight,US,"Tue, 28 Feb 2017 01:00:40 GMT",False,"San Francisco, CA","San Francisco, CA",12 days ago,False,5f243a86a33a23d7,Data Engineer,"indeed_clk(this,'630');",Enjoy coding in <b>Java</b> and <b>Python</b>. Upsight’s mission is to transform the world’s data into valuable action....,Upsight,False,CA,,http://www.indeed.com/viewjob?jk=5f243a86a33a23d7&qd=kzI5tJZPkWJqoVrEwKNhYk2EwljmS6RpeWCeAeJNcjUsMOgh67uUC7WoMUm7Ml1dnuwGf1zpMw3Ed9ueZsPOdWf-XHgHOKyIJO9AK_lLAVu-RVsLkIJ5cbpEhwcYwJqO&indpubnum=8836246992678581&atk=1bb1vrfb8a38jd1s
18,San Francisco,Funding Circle,US,"Sat, 14 Jan 2017 07:45:40 GMT",False,"San Francisco, CA","San Francisco, CA",30+ days ago,False,70be1ac8f64ff694,Ruby Developer,"indeed_clk(this,'630');","3+ years of overall software engineering experience in any language (Ruby, <b>Python</b>, <b>Java</b>, etc). Funding Circle brings together small businesses and investors in...",Funding Circle,False,CA,,http://www.indeed.com/viewjob?jk=70be1ac8f64ff694&qd=kzI5tJZPkWJqoVrEwKNhYk2EwljmS6RpeWCeAeJNcjUsMOgh67uUC7WoMUm7Ml1dnuwGf1zpMw3Ed9ueZsPOdWf-XHgHOKyIJO9AK_lLAVu-RVsLkIJ5cbpEhwcYwJqO&indpubnum=8836246992678581&atk=1bb1vrfb8a38jd1s
19,San Francisco,Verizon,US,"Fri, 24 Feb 2017 19:57:08 GMT",False,"San Francisco, CA","San Francisco, CA 94103",15 days ago,False,f33c302fdfa3d139,Front End Software Developer,"indeed_clk(this,'630');","CoffeeScript, ES6, <b>Python</b>, Objective-C, Swift, <b>Java</b>. We're a small, unique team that has strong experience building and innovating in video at places like Hulu,...",Verizon,False,CA,,http://www.indeed.com/viewjob?jk=f33c302fdfa3d139&qd=kzI5tJZPkWJqoVrEwKNhYk2EwljmS6RpeWCeAeJNcjUsMOgh67uUC7WoMUm7Ml1dnuwGf1zpMw3Ed9ueZsPOdWf-XHgHOKyIJO9AK_lLAVu-RVsLkIJ5cbpEhwcYwJqO&indpubnum=8836246992678581&atk=1bb1vrfb8a38jd1s
20,San Francisco,Cisco,US,"Thu, 09 Mar 2017 01:20:16 GMT",False,"San Francisco, CA","San Francisco, CA",3 days ago,False,abee328ef95c9748,AR/VR Developer,"indeed_clk(this,'630');","Proficiency in <b>Java</b>, Objective C, C++, <b>Python</b> or any other web/mobile focused languages is a plus. AR/VR Developer to join Cisco Emerge....",Cisco Systems,False,CA,,http://www.indeed.com/viewjob?jk=abee328ef95c9748&qd=kzI5tJZPkWJqoVrEwKNhYk2EwljmS6RpeWCeAeJNcjUsMOgh67uUC7WoMUm7Ml1dnuwGf1zpMw3Ed9ueZsPOdWf-XHgHOKyIJO9AK_lLAVu-RVsLkIJ5cbpEhwcYwJqO&indpubnum=8836246992678581&atk=1bb1vrfb8a38jd1s
21,Redwood Shores,Oracle,US,"Fri, 02 Dec 2016 15:55:15 GMT",False,"Redwood Shores, CA","Redwood Shores, CA",30+ days ago,False,a655a52eb2d61d41,Principal Java Developer - Data Security Cloud Service,"indeed_clk(this,'630');","Familiar with <b>Java</b>, <b>Python</b> or Javascript. Developer – Platform Team, Oracle Data Security Cloud Services....",Oracle,False,CA,,http://www.indeed.com/viewjob?jk=a655a52eb2d61d41&qd=kzI5tJZPkWJqoVrEwKNhYk2EwljmS6RpeWCeAeJNcjUsMOgh67uUC7WoMUm7Ml1dnuwGf1zpMw3Ed9ueZsPOdWf-XHgHOKyIJO9AK_lLAVu-RVsLkIJ5cbpEhwcYwJqO&indpubnum=8836246992678581&atk=1bb1vrfb8a38jd1s
22,San Francisco,Capital One,US,"Thu, 02 Mar 2017 20:27:08 GMT",False,"San Francisco, CA","San Francisco, CA",9 days ago,False,f0e307dd56b831f9,Data Engineer,"indeed_clk(this,'630');","Programming in <b>Python</b>, Go, <b>Java</b> (and learning other languages as needed) to process large amounts of structured and unstructured data....",Capital One,False,CA,,http://www.indeed.com/viewjob?jk=f0e307dd56b831f9&qd=kzI5tJZPkWJqoVrEwKNhYk2EwljmS6RpeWCeAeJNcjUsMOgh67uUC7WoMUm7Ml1dnuwGf1zpMw3Ed9ueZsPOdWf-XHgHOKyIJO9AK_lLAVu-RVsLkIJ5cbpEhwcYwJqO&indpubnum=8836246992678581&atk=1bb1vrfb8a38jd1s
23,San Francisco,Fintech Fund Services,US,"Thu, 02 Mar 2017 09:29:54 GMT",False,"San Francisco, CA","San Francisco, CA",10 days ago,False,fe2273eb419119cc,Data Engineer,"indeed_clk(this,'630');","We use Google Compute Engine, BigTable, PostgreSQL, Redis, <b>Python</b>, <b>Java</b> and React, all wrapped in strong design. Familiarity with <b>Java</b> is a plus....",Fintech Fund Services,False,CA,,http://www.indeed.com/viewjob?jk=fe2273eb419119cc&qd=kzI5tJZPkWJqoVrEwKNhYk2EwljmS6RpeWCeAeJNcjUsMOgh67uUC7WoMUm7Ml1dnuwGf1zpMw3Ed9ueZsPOdWf-XHgHOKyIJO9AK_lLAVu-RVsLkIJ5cbpEhwcYwJqO&indpubnum=8836246992678581&atk=1bb1vrfb8a38jd1s
24,San Francisco,Alloy,US,"Thu, 02 Mar 2017 09:21:19 GMT",False,"San Francisco, CA","San Francisco, CA",10 days ago,False,3b2c9a531bd5b83f,Data Engineer,"indeed_clk(this,'630');","We use Google Compute Engine, BigTable, PostgreSQL, Redis, <b>Python</b>, <b>Java</b> and React, all wrapped in strong design. Familiarity with <b>Java</b> is a plus....",Alloy,False,CA,,http://www.indeed.com/viewjob?jk=3b2c9a531bd5b83f&qd=kzI5tJZPkWJqoVrEwKNhYk2EwljmS6RpeWCeAeJNcjUsMOgh67uUC7WoMUm7Ml1dnuwGf1zpMw3Ed9ueZsPOdWf-XHgHOKyIJO9AK_lLAVu-RVsLkIJ5cbpEhwcYwJqO&indpubnum=8836246992678581&atk=1bb1vrfb8a38jd1s
25,San Francisco,IBM,US,"Fri, 03 Mar 2017 21:47:31 GMT",False,"San Francisco, CA","San Francisco, CA",8 days ago,False,55dca1db9014c693,"Developer Advocate -Client, Partner and Industry","indeed_clk(this,'830');","At least 5 years of experience with a broad range of developer technologies and communities (DevOps, <b>Java</b>, Node.js, <b>Python</b>, Ruby on Rails, iOS, Android, etc.)....",IBM,False,CA,,http://www.indeed.com/viewjob?jk=55dca1db9014c693&qd=kzI5tJZPkWJqoVrEwKNhYk2EwljmS6RpeWCeAeJNcjUsMOgh67uUC7WoMUm7Ml1dnuwGf1zpMw3Ed9ueZsPOdWf-XHgHOKyIJO9AK_lLAVu-RVsLkIJ5cbpEhwcYwJqO&indpubnum=8836246992678581&atk=1bb1vrfhf1buq5og
26,San Francisco,IBM,US,"Thu, 02 Mar 2017 21:33:38 GMT",False,"San Francisco, CA","San Francisco, CA",9 days ago,False,d49769dc88141211,"Cloud, Containers and Infrastructure Advocacy Staff Developer","indeed_clk(this,'830');","3-5 years' of specific knowledge of mobile development, mobile platforms, multi-channel app creation, integration, native development (iOS, Android <b>Java</b>, C#)...",IBM,False,CA,,http://www.indeed.com/viewjob?jk=d49769dc88141211&qd=kzI5tJZPkWJqoVrEwKNhYk2EwljmS6RpeWCeAeJNcjUsMOgh67uUC7WoMUm7Ml1dnuwGf1zpMw3Ed9ueZsPOdWf-XHgHOKyIJO9AK_lLAVu-RVsLkIJ5cbpEhwcYwJqO&indpubnum=8836246992678581&atk=1bb1vrfhf1buq5og
27,San Mateo,"OSI Engineering, Inc.",US,"Wed, 08 Feb 2017 16:48:38 GMT",False,"San Mateo, CA","San Mateo, CA",30+ days ago,True,45c91dc7d301d525,"Seeking a Java/Scala Backend Engineer in San Mateo,CA","indeed_clk(this,'830');","Expert-level programming skills in JVM languages such as <b>Java</b> / Scala. Expert with data manipulation and analysis with tools like <b>Python</b>, Shell scripting &amp;...",Indeed,False,CA,,http://www.indeed.com/viewjob?jk=45c91dc7d301d525&qd=kzI5tJZPkWJqoVrEwKNhYk2EwljmS6RpeWCeAeJNcjUsMOgh67uUC7WoMUm7Ml1dnuwGf1zpMw3Ed9ueZsPOdWf-XHgHOKyIJO9AK_lLAVu-RVsLkIJ5cbpEhwcYwJqO&indpubnum=8836246992678581&atk=1bb1vrfhf1buq5og
28,San Mateo,Cirrent,US,"Fri, 10 Feb 2017 07:06:49 GMT",False,"San Mateo, CA","San Mateo, CA",30 days ago,True,ce30581a4549a7f6,Firmware Developer,"indeed_clk(this,'830');","C, C++, <b>python</b>, <b>java</b>. We’re looking for a firmware developer to work on Cirrent’s platform, which powers many types of connected products....",Cirrent,False,CA,,http://www.indeed.com/viewjob?jk=ce30581a4549a7f6&qd=kzI5tJZPkWJqoVrEwKNhYk2EwljmS6RpeWCeAeJNcjUsMOgh67uUC7WoMUm7Ml1dnuwGf1zpMw3Ed9ueZsPOdWf-XHgHOKyIJO9AK_lLAVu-RVsLkIJ5cbpEhwcYwJqO&indpubnum=8836246992678581&atk=1bb1vrfhf1buq5og
29,San Francisco,TinyCo,US,"Wed, 22 Feb 2017 06:38:53 GMT",False,"San Francisco, CA","San Francisco, CA",18 days ago,False,99a904484d30ab66,Backend Engineer,"indeed_clk(this,'830');","Experience with hardcore server-side coding using <b>Java</b> or <b>Python</b>. Linux, MySQL, <b>Python</b>). Amazon AWS, <b>Python</b>, Django, Any Web Framework, Linux, MySQL, Unix, Mac...",TinyCo,False,CA,,http://www.indeed.com/viewjob?jk=99a904484d30ab66&qd=kzI5tJZPkWJqoVrEwKNhYk2EwljmS6RpeWCeAeJNcjUsMOgh67uUC7WoMUm7Ml1dnuwGf1zpMw3Ed9ueZsPOdWf-XHgHOKyIJO9AK_lLAVu-RVsLkIJ5cbpEhwcYwJqO&indpubnum=8836246992678581&atk=1bb1vrfhf1buq5og
30,San Francisco,IBM,US,"Tue, 28 Feb 2017 21:26:26 GMT",False,"San Francisco, CA","San Francisco, CA",11 days ago,False,ed6df11bd4829304,"Developer Advocate -Cognitive, Data and Analytics","indeed_clk(this,'830');","At least 5 years of experience with a broad range of developer technologies and communities (DevOps, <b>Java</b>, Node.js, <b>Python</b>, Ruby on Rails, iOS, Android, etc.)....",IBM,False,CA,,http://www.indeed.com/viewjob?jk=ed6df11bd4829304&qd=kzI5tJZPkWJqoVrEwKNhYk2EwljmS6RpeWCeAeJNcjUsMOgh67uUC7WoMUm7Ml1dnuwGf1zpMw3Ed9ueZsPOdWf-XHgHOKyIJO9AK_lLAVu-RVsLkIJ5cbpEhwcYwJqO&indpubnum=8836246992678581&atk=1bb1vrfhf1buq5og
31,San Francisco,BlackRock,US,"Fri, 10 Mar 2017 00:45:34 GMT",False,"San Francisco, CA","San Francisco, CA 94102",2 days ago,False,6f1559a0ca22b109,Software Engineer,"indeed_clk(this,'830');","2+ years of professional software development experience Development experience working with Backbone, Angular or React and SASS Experience working with Ruby on...",BlackRock,False,CA,,http://www.indeed.com/viewjob?jk=6f1559a0ca22b109&qd=kzI5tJZPkWJqoVrEwKNhYk2EwljmS6RpeWCeAeJNcjUsMOgh67uUC7WoMUm7Ml1dnuwGf1zpMw3Ed9ueZsPOdWf-XHgHOKyIJO9AK_lLAVu-RVsLkIJ5cbpEhwcYwJqO&indpubnum=8836246992678581&atk=1bb1vrfhf1buq5og
32,San Francisco,Pinterest,US,"Tue, 07 Mar 2017 00:44:17 GMT",False,"San Francisco, CA","San Francisco, CA 94103",5 days ago,True,fd1a5da2d19a561e,"Software Engineer, Video and Image Platform","indeed_clk(this,'830');","Knowledge of <b>Java</b>, C/C++ and/or <b>Python</b>. As a software engineer on this team, you will help build the next generation of media platform in order to process and...",Pinterest,False,CA,,http://www.indeed.com/viewjob?jk=fd1a5da2d19a561e&qd=kzI5tJZPkWJqoVrEwKNhYk2EwljmS6RpeWCeAeJNcjUsMOgh67uUC7WoMUm7Ml1dnuwGf1zpMw3Ed9ueZsPOdWf-XHgHOKyIJO9AK_lLAVu-RVsLkIJ5cbpEhwcYwJqO&indpubnum=8836246992678581&atk=1bb1vrfhf1buq5og
33,San Francisco,HIRECLOUT,US,"Fri, 10 Mar 2017 07:16:25 GMT",False,"San Francisco, CA","San Francisco, CA",2 days ago,False,0d470e714f4c7f55,Sr. Software Engineer,"indeed_clk(this,'830');","C/C++, Objective-C, <b>Java</b>, JavaScript, Mobile Software Development (iOS, Android)Note:. BA, BS, MS or PhD in Computer Science or related technical...",HireClout,False,CA,,http://www.indeed.com/viewjob?jk=0d470e714f4c7f55&qd=kzI5tJZPkWJqoVrEwKNhYk2EwljmS6RpeWCeAeJNcjUsMOgh67uUC7WoMUm7Ml1dnuwGf1zpMw3Ed9ueZsPOdWf-XHgHOKyIJO9AK_lLAVu-RVsLkIJ5cbpEhwcYwJqO&indpubnum=8836246992678581&atk=1bb1vrfhf1buq5og
34,San Francisco,Vida,US,"Sun, 12 Mar 2017 08:12:55 GMT",False,"San Francisco, CA","San Francisco, CA 94110",11 hours ago,True,fd8fd2251d355746,"Full Stack Engineer, Product/Platform","indeed_clk(this,'830');","Extensive programming experience with <b>Java</b>, JavaScript, C/C++, C#, Objective-C, Swift, Python; 2+ years’ experience programming experience in <b>Java</b>, JavaScript,...",Vida,False,CA,,http://www.indeed.com/viewjob?jk=fd8fd2251d355746&qd=kzI5tJZPkWJqoVrEwKNhYk2EwljmS6RpeWCeAeJNcjUsMOgh67uUC7WoMUm7Ml1dnuwGf1zpMw3Ed9ueZsPOdWf-XHgHOKyIJO9AK_lLAVu-RVsLkIJ5cbpEhwcYwJqO&indpubnum=8836246992678581&atk=1bb1vrfhf1buq5og
35,San Francisco,Autodesk,US,"Fri, 24 Feb 2017 12:22:26 GMT",False,"San Francisco, CA","San Francisco, CA",16 days ago,False,63300a488d69774a,UI/UX Developer,"indeed_clk(this,'830');","Proven programming experience (preferably <b>Python</b>, Ruby, or <b>Java</b>). Be able to work with data from a variety of sources, and connect the data feed via statistics...",Autodesk,False,CA,,http://www.indeed.com/viewjob?jk=63300a488d69774a&qd=kzI5tJZPkWJqoVrEwKNhYk2EwljmS6RpeWCeAeJNcjUsMOgh67uUC7WoMUm7Ml1dnuwGf1zpMw3Ed9ueZsPOdWf-XHgHOKyIJO9AK_lLAVu-RVsLkIJ5cbpEhwcYwJqO&indpubnum=8836246992678581&atk=1bb1vrfhf1buq5og
36,San Francisco,Yelp,US,"Tue, 20 Dec 2016 09:58:33 GMT",False,"San Francisco, CA","San Francisco, CA 94105",30+ days ago,False,b0cd74aba04aa1f3,Software Engineer - Eat24 Application Backend Developer,"indeed_clk(this,'830');","Mastery of at least one programming language - <b>Python</b>, Objective-C, <b>Java</b>, etc. Yelp Eat24 is the Internet’s favorite way to order food delivery online from over...",Yelp,False,CA,,http://www.indeed.com/viewjob?jk=b0cd74aba04aa1f3&qd=kzI5tJZPkWJqoVrEwKNhYk2EwljmS6RpeWCeAeJNcjUsMOgh67uUC7WoMUm7Ml1dnuwGf1zpMw3Ed9ueZsPOdWf-XHgHOKyIJO9AK_lLAVu-RVsLkIJ5cbpEhwcYwJqO&indpubnum=8836246992678581&atk=1bb1vrfhf1buq5og
37,San Francisco,FutureAdvisor,US,"Sat, 04 Feb 2017 01:32:02 GMT",False,"San Francisco, CA","San Francisco, CA",30+ days ago,False,2ba626f216524ff5,Software Engineer,"indeed_clk(this,'830');",<b>Java</b> Developers with strong <b>Python</b> skills that would like to learn Ruby. FutureAdvisor is a team of engineers and finance geeks revolutionizing the finance...,FutureAdvisor,False,CA,,http://www.indeed.com/viewjob?jk=2ba626f216524ff5&qd=kzI5tJZPkWJqoVrEwKNhYk2EwljmS6RpeWCeAeJNcjUsMOgh67uUC7WoMUm7Ml1dnuwGf1zpMw3Ed9ueZsPOdWf-XHgHOKyIJO9AK_lLAVu-RVsLkIJ5cbpEhwcYwJqO&indpubnum=8836246992678581&atk=1bb1vrfhf1buq5og
38,San Francisco,Uber,US,"Wed, 15 Feb 2017 06:12:57 GMT",False,"San Francisco, CA","San Francisco, CA 94103",25 days ago,False,5d2fa13cca9a6994,Data Scientist: Mapping Technologies,"indeed_clk(this,'830');","<b>Java</b>, C++, C#) a plus. Ability to develop ML or statistical analysis software in R or <b>python</b> Experience with other object-oriented programming languages (e.g....",Uber,False,CA,,http://www.indeed.com/viewjob?jk=5d2fa13cca9a6994&qd=kzI5tJZPkWJqoVrEwKNhYk2EwljmS6RpeWCeAeJNcjUsMOgh67uUC7WoMUm7Ml1dnuwGf1zpMw3Ed9ueZsPOdWf-XHgHOKyIJO9AK_lLAVu-RVsLkIJ5cbpEhwcYwJqO&indpubnum=8836246992678581&atk=1bb1vrfhf1buq5og
39,San Francisco,Synopsys,US,"Thu, 02 Mar 2017 10:39:50 GMT",False,"San Francisco, CA","San Francisco, CA",10 days ago,False,f74e998a246be5b6,Sr. Software Engineer-Java,"indeed_clk(this,'830');","Expert in <b>Java</b> development. Experience in other languages such as C, C++ and <b>Python</b>. This position requires strong expertise in <b>Java</b> and hands-on experience...",Synopsys,False,CA,,http://www.indeed.com/viewjob?jk=f74e998a246be5b6&qd=kzI5tJZPkWJqoVrEwKNhYk2EwljmS6RpeWCeAeJNcjUsMOgh67uUC7WoMUm7Ml1dnuwGf1zpMw3Ed9ueZsPOdWf-XHgHOKyIJO9AK_lLAVu-RVsLkIJ5cbpEhwcYwJqO&indpubnum=8836246992678581&atk=1bb1vrfhf1buq5og
40,San Francisco,ironSource,US,"Mon, 20 Feb 2017 11:42:58 GMT",False,"San Francisco, CA","San Francisco, CA",20 days ago,False,2d365f3af6490084,Fullstack JavaScript Developer-Video,"indeed_clk(this,'830');","Knowledge of another language (Go, <b>Python</b>, <b>Java</b>, etc). If you are a brilliant Javascript developer, who has passion for the web, we want you to join our team...",ironSource,False,CA,,http://www.indeed.com/viewjob?jk=2d365f3af6490084&qd=kzI5tJZPkWJqoVrEwKNhYk2EwljmS6RpeWCeAeJNcjUsMOgh67uUC7WoMUm7Ml1dnuwGf1zpMw3Ed9ueZsPOdWf-XHgHOKyIJO9AK_lLAVu-RVsLkIJ5cbpEhwcYwJqO&indpubnum=8836246992678581&atk=1bb1vrfhf1buq5og
